{
  "$schema": "https://json-schema.org/draft/2020-12/schema",
  "$id": "https://leoflow.io/schemas/dag.json/v1.0",
  "title": "Dexaflow DAG Specification",
  "description": "Canonical serialized representation of a DAG, consumed by the Dexaflow Control Plane.",
  "type": "object",
  "required": [
    "schema_version",
    "dag_id",
    "dag_version",
    "image",
    "tasks"
  ],
  "additionalProperties": false,
  "properties": {
    "schema_version": {
      "type": "string",
      "const": "1.0",
      "description": "Semver of this DAG specification format."
    },
    "dag_id": {
      "type": "string",
      "pattern": "^[a-zA-Z0-9_][a-zA-Z0-9_-]{0,199}$",
      "description": "User-facing DAG identifier. Unique within a tenant."
    },
    "dag_version": {
      "type": "string",
      "description": "Version of this DAG snapshot. Typically a Git tag or build identifier."
    },
    "image": {
      "type": "string",
      "description": "Fully qualified container image reference (e.g., 'myrepo/etl:v1.2.3')."
    },
    "description": {
      "type": "string"
    },
    "owner": {
      "type": "string"
    },
    "tags": {
      "type": "array",
      "items": {
        "type": "string"
      },
      "uniqueItems": true
    },
    "schedule": {
      "type": [
        "string",
        "null"
      ],
      "description": "Cron expression, preset ('@daily', '@hourly'), or null for manual-only."
    },
    "schedule_timezone": {
      "type": "string",
      "default": "UTC"
    },
    "start_date": {
      "type": "string",
      "format": "date-time"
    },
    "end_date": {
      "type": [
        "string",
        "null"
      ],
      "format": "date-time"
    },
    "max_active_runs": {
      "type": "integer",
      "minimum": 1,
      "default": 16
    },
    "max_active_tasks": {
      "type": "integer",
      "minimum": 1
    },
    "min_idle_workers": {
      "type": "integer",
      "minimum": 0,
      "description": "Idle warm workers kept for this DAG version so its tasks skip the cold pod start (ADR 0058, ADR 0082). Declared as min_idle_workers in dexaflow.yaml, which the compiler copies here. With warm pools on, an unpaused DAG whose current version carries it is prewarmed before its first run; the server clamps it to execution.max_pool_size, and with warm pools off it does nothing. 0 (default) declares none."
    },
    "catchup": {
      "type": "boolean",
      "default": false
    },
    "is_paused_upon_creation": {
      "type": "boolean",
      "description": "Airflow's is_paused_upon_creation: whether the DAG starts paused when it is registered for the first time. Overrides the server's dags_are_paused_at_creation; when absent, that setting decides. Ignored for a DAG that already exists."
    },
    "default_args": {
      "type": "object",
      "properties": {
        "retries": {
          "type": "integer",
          "minimum": 0,
          "maximum": 100,
          "default": 0
        },
        "retry_delay_seconds": {
          "type": "integer",
          "minimum": 0,
          "default": 300
        },
        "execution_timeout_seconds": {
          "type": "integer",
          "minimum": 1
        }
      },
      "additionalProperties": false
    },
    "staging": {
      "type": "object",
      "description": "Opt-in per-DAG-run shared RWX volume mounted at /staging (ADR 0022).",
      "properties": {
        "enabled": { "type": "boolean", "default": false },
        "size": { "type": "string", "description": "Kubernetes quantity, e.g. 5Gi." },
        "storage_class": { "type": "string", "description": "RWX StorageClass; empty = cluster default." }
      },
      "additionalProperties": false
    },
    "alerts": {
      "type": "object",
      "description": "Native on-failure alerting (#424), overlaid from dexaflow.yaml; the scheduler fires it when the DagRun reaches failed.",
      "properties": {
        "on_failure": {
          "type": "array",
          "items": {
            "type": "object",
            "properties": {
              "type": { "type": "string", "enum": ["slack", "webhook"] },
              "conn": { "type": "string", "minLength": 1 },
              "message": { "type": "string" }
            },
            "required": ["type", "conn"],
            "additionalProperties": false
          }
        }
      },
      "additionalProperties": false
    },
    "variables": {
      "type": "array",
      "items": { "type": "string" },
      "uniqueItems": true,
      "description": "Airflow Variable names this DAG declares (ADR 0045, ADR 0055). A task receives a Variable only if declared; tasks may narrow further. Absent (empty) declares none."
    },
    "connections": {
      "type": "array",
      "items": { "type": "string" },
      "uniqueItems": true,
      "description": "Managed connection ids this DAG declares (ADR 0045, ADR 0055). A task receives a connection only if declared; tasks may narrow further. Distinct from connectors: (pip provider packages, ADR 0038). Absent (empty) declares none."
    },
    "params": {
      "type": "object",
      "description": "Author-declared DAG-run parameters (Airflow's params=), keyed by name. Each provides a default merged into a run's conf and an optional JSON Schema validated against the trigger-time value. Absent declares none (back-compatible).",
      "additionalProperties": {
        "type": "object",
        "properties": {
          "default": { "description": "Default value merged into a run's conf when the trigger omits this key. Absent means the param is required — the trigger must supply it." },
          "schema": {
            "type": "object",
            "description": "JSON Schema the trigger-time conf value is validated against; {} means no constraints."
          }
        },
        "additionalProperties": false
      }
    },
    "tasks": {
      "type": "array",
      "minItems": 1,
      "items": {
        "$ref": "#/$defs/task"
      }
    },
    "source": {
      "type": "string",
      "description": "Original dag.py source, captured at compile time for the UI Code view."
    }
  },
  "$defs": {
    "task": {
      "type": "object",
      "required": [
        "task_id",
        "type"
      ],
      "additionalProperties": false,
      "properties": {
        "task_id": {
          "type": "string",
          "pattern": "^[a-zA-Z0-9_][a-zA-Z0-9_-]{0,199}$"
        },
        "type": {
          "type": "string",
          "enum": [
            "python",
            "bash",
            "airflow_operator"
          ]
        },
        "operator_class": {
          "type": "string",
          "description": "For type=airflow_operator: the dotted Airflow operator/sensor class the runtime imports and executes (ADR 0040)."
        },
        "operator_args": {
          "type": "object",
          "description": "For type=airflow_operator: the operator's constructor kwargs captured at compile time."
        },
        "on_failure_callback": {
          "type": "boolean",
          "description": "Marks that the task declares an Airflow on_failure_callback (#424); the runtime runs it in the task process on the final failure. The callable itself is not carried: a @task reads it off its entrypoint, an operator off its task in the module its entrypoint names (#484)."
        },
        "depends_on": {
          "type": "array",
          "items": {
            "type": "string"
          },
          "uniqueItems": true,
          "default": []
        },
        "trigger_rule": {
          "type": "string",
          "enum": [
            "all_success",
            "all_failed",
            "all_done",
            "one_success",
            "one_failed"
          ],
          "default": "all_success"
        },
        "pool": {
          "type": "string",
          "description": "The named task pool this task draws a concurrency slot from (Airflow's pool). Empty means the implicit default_pool. Enforced Pro-only (ADR 0053); ignored on Lite."
        },
        "pool_slots": {
          "type": "integer",
          "minimum": 1,
          "maximum": 1024,
          "description": "How many slots of its pool the task takes while queued or running (Airflow's pool_slots, ADR 0066). Absent means 1. dexaflow.yaml sets it as size."
        },
        "retries": {
          "type": "integer",
          "minimum": 0,
          "maximum": 100
        },
        "retry_delay_seconds": {
          "type": "integer",
          "minimum": 0
        },
        "execution_timeout_seconds": {
          "type": "integer",
          "minimum": 1
        },
        "execution_mode": {
          "type": "string",
          "enum": [
            "pod"
          ],
          "default": "pod",
          "description": "How a task runs. Every task (python, bash, airflow_operator) runs inside a worker pod via the agent; 'pod' is the only supported value and the default. Retained for forward compatibility."
        },
        "entrypoint": {
          "type": "string",
          "description": "For type=python: 'module.path:callable'. For type=bash: shell command. For type=airflow_operator with on_failure_callback: 'module:task_id', the DAG module the runtime imports on the final failed attempt to read the callback."
        },
        "env": {
          "type": "object",
          "additionalProperties": {
            "type": "string"
          },
          "description": "Environment variables for the worker pod / process."
        },
        "variables": {
          "type": "array",
          "items": { "type": "string" },
          "uniqueItems": true,
          "description": "Airflow Variable names this task declares, narrowing the DAG-level declaration (ADR 0045, ADR 0055). Absent inherits the DAG's declaration."
        },
        "connections": {
          "type": "array",
          "items": { "type": "string" },
          "uniqueItems": true,
          "description": "Managed connection ids this task declares, narrowing the DAG-level declaration (ADR 0045, ADR 0055). Absent inherits the DAG's declaration."
        },
        "resources": {
          "type": "object",
          "properties": {
            "requests": {
              "$ref": "#/$defs/resource_quantity"
            },
            "limits": {
              "$ref": "#/$defs/resource_quantity"
            },
            "claims": {
              "type": "array",
              "description": "Dynamic Resource Allocation (DRA, GA in Kubernetes 1.34): the pod-level resource_claims this container consumes. Each entry names a claim (and optionally a request within it) declared in execution.resource_claims.",
              "items": {
                "type": "object"
              }
            }
          },
          "additionalProperties": false
        },
        "execution": {
          "type": "object",
          "description": "Executor-specific placement and scheduling hints. Applied only by the Kubernetes executor; ignored by Lite (subprocess, no pods).",
          "properties": {
            "node_selector": {
              "type": "object",
              "additionalProperties": {
                "type": "string"
              }
            },
            "tolerations": {
              "type": "array",
              "items": {
                "type": "object"
              }
            },
            "service_account": {
              "type": "string"
            },
            "image_pull_policy": {
              "type": "string",
              "enum": [
                "Always",
                "IfNotPresent",
                "Never"
              ],
              "default": "IfNotPresent"
            },
            "priority_class_name": {
              "type": "string",
              "description": "Ranks this task pod against neighbors on a shared cluster; the named PriorityClass is platform-owned and cluster-scoped (ADR 0054)."
            },
            "termination_grace_period_seconds": {
              "type": "integer",
              "minimum": 0,
              "description": "Seconds the pod is given to shut down before SIGKILL. Omit for the cluster default (30s)."
            },
            "runtime_class_name": {
              "type": "string",
              "description": "Selects an alternate container runtime (e.g. a sandboxed or GPU runtime) registered as a RuntimeClass."
            },
            "topology_spread_constraints": {
              "type": "array",
              "description": "Spread a DAG's task pods across failure domains (zones, nodes). Each entry is a Kubernetes TopologySpreadConstraint.",
              "items": {
                "type": "object"
              }
            },
            "affinity": {
              "type": "object",
              "description": "Pins or repels a task pod relative to nodes and other pods (node/pod affinity and anti-affinity). A Kubernetes Affinity object."
            },
            "resource_claims": {
              "type": "array",
              "description": "Pod-level ResourceClaims for Dynamic Resource Allocation (DRA, GA in Kubernetes 1.34) — e.g. a GPU from a claim template. Each entry is a Kubernetes PodResourceClaim; a container consumes one via resources.claims.",
              "items": {
                "type": "object"
              }
            },
            "labels": {
              "type": "object",
              "description": "Operator-declared pod labels merged onto the task pod. Keys under the leoflow.io/ prefix are reserved for Dexaflow and rejected.",
              "additionalProperties": {
                "type": "string"
              }
            },
            "annotations": {
              "type": "object",
              "description": "Operator-declared pod annotations merged onto the task pod. Keys under the leoflow.io/ prefix are reserved for Dexaflow and rejected.",
              "additionalProperties": {
                "type": "string"
              }
            }
          }
        },
        "xcom_input": {
          "type": "object",
          "description": "Map of parameter name to ordered list of upstream task_ids whose return values to inject. A 1-element list is the common single-upstream case; longer lists are fan-in (the runtime delivers a JSON array, in declaration order).",
          "additionalProperties": {
            "type": "array",
            "items": {"type": "string"},
            "minItems": 1
          }
        },
        "call_args": {
          "type": "object",
          "description": "TaskFlow literal call arguments captured at compile time (#115). Delivered to the runtime as LEOFLOW_CALL_ARGS_JSON. Each value must be JSON-serialisable; XCom upstreams take precedence at runtime over a same-name literal. Named call_args (not params) to leave Airflow's DAG-run params term free for a future feature.",
          "additionalProperties": true
        },
        "params": {
          "type": "object",
          "description": "For type=bash and type=python: the task's own params (Airflow's task-level params=), captured at compile time (#1843). The control plane layers them over the DAG's param defaults and under the run conf into the task's params context. A captured operator carries its params in operator_args instead.",
          "additionalProperties": true
        },
        "xcom_schema": {
          "type": "object",
          "description": "Optional JSON Schema for XCom output validation."
        }
      },
      "allOf": [
        {
          "if": {
            "properties": {
              "type": {
                "const": "python"
              }
            }
          },
          "then": {
            "required": [
              "entrypoint"
            ]
          }
        },
        {
          "if": {
            "properties": {
              "type": {
                "const": "bash"
              }
            }
          },
          "then": {
            "required": [
              "entrypoint"
            ]
          }
        }
      ]
    },
    "resource_quantity": {
      "type": "object",
      "properties": {
        "cpu": {
          "type": "string",
          "description": "Kubernetes-style: '500m', '2', '1.5'."
        },
        "memory": {
          "type": "string",
          "description": "Kubernetes-style: '512Mi', '2Gi'."
        },
        "ephemeral_storage": {
          "type": "string",
          "description": "Kubernetes-style node-local scratch limit, e.g. '2Gi'. Bounds writable-layer/emptyDir/log usage so a runaway task cannot evict neighbors under disk pressure (ADR 0054)."
        }
      },
      "additionalProperties": false
    }
  }
}
