{
  "schema_version": "1.0",
  "dag_id": "gcp_probe",
  "dag_version": "f590e593-040f5b7441e2",
  "image": "us-central1-docker.pkg.dev/${GCP_PROJECT}/leoflow-validate/gcp-probe:f590e593",
  "owner": "gcp-experiments",
  "tags": [
    "gcp-experiment"
  ],
  "max_active_runs": 64,
  "tasks": [
    {
      "task_id": "probe",
      "type": "python",
      "entrypoint": "dag:probe"
    }
  ],
  "source": "\"\"\"gcp_probe: the smallest DAG that still exercises the pod-per-task path.\n\nOne task that sleeps briefly and exits. That is deliberate. These experiments\nmeasure the time to GET a task pod running (dispatch, schedule, image pull,\ncontainer start), so the work inside the pod is noise that would only add\nvariance to the phase being measured.\n\nThe sleep is not zero: a pod that exits instantly can reach a terminal state\nbefore the informer observes it Running, which would drop the `start` phase\nobservation for that pod and quietly bias the series toward the slow pods that\ndid get observed.\n\"\"\"\nfrom __future__ import annotations\n\nimport os\nimport time\n\nfrom airflow.sdk import DAG, task\n\n\n@task\ndef probe() -\u003e dict:\n    dwell = float(os.environ.get(\"GCP_PROBE_DWELL_SECONDS\", \"5\"))\n    started = time.time()\n    time.sleep(dwell)\n    # Printed so a pod's own log can be correlated with the phase timings the\n    # runner reconstructs from the Kubernetes API, which are quantized to one\n    # second and cannot be checked against anything else.\n    print(f\"probe: dwelled {time.time() - started:.2f}s\")\n    return {\"dwell\": dwell}\n\n\nwith DAG(\n    \"gcp_probe\",\n    schedule=None,          # triggered by the runner, never by a timer\n    catchup=False,\n    max_active_runs=64,     # the runner drives concurrency; the DAG must not cap it\n    tags=[\"gcp-experiment\"],\n):\n    probe()\n"
}
